,paper,doi,url,paper_title,research_field_label
1455,http://orkg.org/orkg/resource/R262028,10.1109/icimtech.2018.8528122,http://dx.doi.org/10.1109/ICIMTech.2018.8528122,Classification of Land Cover from Sentinel-2 Imagery Using Supervised Classification Technique (Preliminary Study),Environmental Sciences
1456,http://orkg.org/orkg/resource/R262033,10.1109/eesms.2018.8405830,http://dx.doi.org/10.1109/EESMS.2018.8405830,Land cover and crop classification using multitemporal sentinel-2 images based on crops phenological cycle,Environmental Sciences
1457,http://orkg.org/orkg/resource/R262039,10.3390/agriculture12091429,http://dx.doi.org/10.3390/agriculture12091429,Sentinel-2 Data for Land Use Mapping: Comparing Different Supervised Classifications in Semi-Arid Areas,Environmental Sciences
1458,http://orkg.org/orkg/resource/R264000,10.1016/j.jclepro.2022.135211,http://dx.doi.org/10.1016/j.jclepro.2022.135211,Sustainable supply chain network design for municipal solid waste management: A case study,"Operations Research, Systems Engineering and Industrial Engineering"
1459,http://orkg.org/orkg/resource/R264004,10.1016/j.seta.2022.102809,http://dx.doi.org/10.1016/j.seta.2022.102809,Municipal solid waste management and energy production: A multi-objective optimization approach to incineration and biogas waste-to-energy supply chain,"Operations Research, Systems Engineering and Industrial Engineering"
1460,http://orkg.org/orkg/resource/R266003,10.35530/it.072.01.1797,http://dx.doi.org/10.35530/IT.072.01.1797,A review: life cycle assessment of cotton textiles,"Operations Research, Systems Engineering and Industrial Engineering"
1461,http://orkg.org/orkg/resource/R266006,10.1016/j.ecolecon.2005.11.027,http://dx.doi.org/10.1016/j.ecolecon.2005.11.027,The water footprint of cotton consumption: An assessment of the impact of worldwide consumption of cotton products on the water resources in the cotton producing countries,"Operations Research, Systems Engineering and Industrial Engineering"
1462,http://orkg.org/orkg/resource/R266010,10.3390/en14113032,http://dx.doi.org/10.3390/en14113032,"Looking for Sustainability Scoring in Apparel: A Review on Environmental Footprint, Social Impacts and Transparency","Operations Research, Systems Engineering and Industrial Engineering"
1463,http://orkg.org/orkg/resource/R266014,10.1080/00405000.2018.1434113,http://dx.doi.org/10.1080/00405000.2018.1434113,Assessing environmental impact of textile supply chain using life cycle assessment methodology,"Operations Research, Systems Engineering and Industrial Engineering"
1464,http://orkg.org/orkg/resource/R266018,10.1016/j.psep.2021.09.029,http://dx.doi.org/10.1016/j.psep.2021.09.029,A review on the treatment of textile industry effluents through Fenton processes,"Operations Research, Systems Engineering and Industrial Engineering"
1465,http://orkg.org/orkg/resource/R266021,10.1186/s42834-019-0043-2,http://dx.doi.org/10.1186/s42834-019-0043-2,Integrated electrochemical processes for textile industry wastewater treatment: system performances and sludge settling characteristics,"Operations Research, Systems Engineering and Industrial Engineering"
1466,http://orkg.org/orkg/resource/R266025,10.1016/j.scs.2022.103857,http://dx.doi.org/10.1016/j.scs.2022.103857,Municipal solid waste recycling network with sustainability and supply uncertainty considerations,"Operations Research, Systems Engineering and Industrial Engineering"
1467,http://orkg.org/orkg/resource/R266028,10.1016/j.jclepro.2022.133536,http://dx.doi.org/10.1016/j.jclepro.2022.133536,Crisp and fuzzy optimization models for sustainable municipal solid waste management,"Operations Research, Systems Engineering and Industrial Engineering"
1468,http://orkg.org/orkg/resource/R266033,10.1016/j.compchemeng.2022.107725,http://dx.doi.org/10.1016/j.compchemeng.2022.107725,Municipal solid waste supply chain management under an integrated optimization of sustainability targets,"Operations Research, Systems Engineering and Industrial Engineering"
1469,http://orkg.org/orkg/resource/R266037,10.1016/j.scs.2020.102566,http://dx.doi.org/10.1016/j.scs.2020.102566,"A planning model for using municipal solid waste management technologies- considering Energy, Economic, and Environmental Impacts in Tehran-Iran","Operations Research, Systems Engineering and Industrial Engineering"
1470,http://orkg.org/orkg/resource/R266042,10.1016/j.jclepro.2020.123824,http://dx.doi.org/10.1016/j.jclepro.2020.123824,Sustainable design modifications municipal solid waste management network and better optimization for risk reduction analyses,"Operations Research, Systems Engineering and Industrial Engineering"
1471,http://orkg.org/orkg/resource/R266044,10.1016/j.wasman.2019.10.038,http://dx.doi.org/10.1016/j.wasman.2019.10.038,A robust green location-allocation-inventory problem to design an urban waste management system under uncertainty,"Operations Research, Systems Engineering and Industrial Engineering"
1472,http://orkg.org/orkg/resource/R266047,10.1016/j.jclepro.2019.118003,http://dx.doi.org/10.1016/j.jclepro.2019.118003,Location of mixed municipal waste treatment facilities: Cost of reducing greenhouse gas emissions,"Operations Research, Systems Engineering and Industrial Engineering"
1473,http://orkg.org/orkg/resource/R266050,10.1016/j.jwpe.2020.101377,http://dx.doi.org/10.1016/j.jwpe.2020.101377,Electrochemical generation of H2O2 using gas diffusion electrode improved with rGO intensified with the Fe3O4/GO catalyst for degradation of textile wastewater,"Operations Research, Systems Engineering and Industrial Engineering"
1474,http://orkg.org/orkg/resource/R266053,10.1016/j.jphotochem.2019.112095,http://dx.doi.org/10.1016/j.jphotochem.2019.112095,Statistical optimization of the photo-Fenton operational parameters with in situ ferrioxalate induction in the treatment of textile effluent,"Operations Research, Systems Engineering and Industrial Engineering"
1475,http://orkg.org/orkg/resource/R266058,10.1007/s13762-018-1696-9,http://dx.doi.org/10.1007/s13762-018-1696-9,"Parametric study of electro-Fenton treatment for real textile wastewater, disposal study and its cost analysis",Environmental Sciences
1476,http://orkg.org/orkg/resource/R266061,10.5004/dwt.2019.24332,http://dx.doi.org/10.5004/dwt.2019.24332,Treatability of raw textile wastewater using Fenton process and its comparison with chemical coagulation,Environmental Sciences
1477,http://orkg.org/orkg/resource/R266064,10.22214/ijraset.2018.1105,http://dx.doi.org/10.22214/ijraset.2018.1105,Reduction of COD of Textile Industry Waste Water by Using Acoustic Cavitation Coupled with Advanced Oxidation Processes,Environmental Sciences
1478,http://orkg.org/orkg/resource/R266067,10.1016/j.chemosphere.2018.05.114,http://dx.doi.org/10.1016/j.chemosphere.2018.05.114,Transformation products and degradation pathway of textile industry wastewater pollutants in Electro-Fenton process,Environmental Sciences
1479,http://orkg.org/orkg/resource/R266071,10.1016/j.molliq.2018.02.047,http://dx.doi.org/10.1016/j.molliq.2018.02.047,The performance study on ultrasonic/Fe 3 O 4 /H 2 O 2 for degradation of azo dye and real textile wastewater treatment,Environmental Sciences
1480,http://orkg.org/orkg/resource/R266077,10.1016/j.resconrec.2015.08.007,http://dx.doi.org/10.1016/j.resconrec.2015.08.007,Life cycle assessment of cotton textile products in Turkey,Environmental Sciences
1481,http://orkg.org/orkg/resource/R266080,10.1007/s11367-013-0626-9,http://dx.doi.org/10.1007/s11367-013-0626-9,"LCA benchmarking study on textiles made of cotton, polyester, nylon, acryl, or elastane",Environmental Sciences
1482,http://orkg.org/orkg/resource/R266083,10.1007/s11367-015-0889-4,http://dx.doi.org/10.1007/s11367-015-0889-4,Life cycle assessment of cotton T-shirts in China,Environmental Sciences
1483,http://orkg.org/orkg/resource/R266086,10.1021/es2001248,http://dx.doi.org/10.1021/es2001248,Prospective Environmental Life Cycle Assessment of Nanosilver T-Shirts,Environmental Sciences
1484,http://orkg.org/orkg/resource/R266089,10.1007/s11367-015-0975-7,http://dx.doi.org/10.1007/s11367-015-0975-7,Benchmarking and environmental performance classes in life cycle assessment—development of a procedure for non-leather shoes in the context of the Product Environmental Footprint,Environmental Sciences
1485,http://orkg.org/orkg/resource/R266093,10.1007/s11367-015-0895-6,http://dx.doi.org/10.1007/s11367-015-0895-6,Three methods for strategic product toxicity assessment—the case of the cotton T-shirt,Environmental Sciences
1486,http://orkg.org/orkg/resource/R266096,10.1007/s11367-010-0197-y,http://dx.doi.org/10.1007/s11367-010-0197-y,Environmental benefits from reusing clothes,Environmental Sciences
1487,http://orkg.org/orkg/resource/R266097,10.1007/s11367-010-0197-y,http://dx.doi.org/10.1007/s11367-010-0197-y,Environmental benefits from reusing clothes,Environmental Sciences
1488,http://orkg.org/orkg/resource/R266102,10.1016/j.jclepro.2015.10.112,http://dx.doi.org/10.1016/j.jclepro.2015.10.112,Eco-efficiency of cotton-cropping systems in Pakistan: an integrated approach of life cycle assessment and data envelopment analysis,Environmental Sciences
1489,http://orkg.org/orkg/resource/R266105,10.1016/j.jclepro.2018.11.190,http://dx.doi.org/10.1016/j.jclepro.2018.11.190,Farm-level strategies to reduce the life cycle greenhouse gas emissions of cotton production: An Australian perspective,Environmental Sciences
1490,http://orkg.org/orkg/resource/R266206,10.1128/mmbr.00064-21,http://dx.doi.org/10.1128/MMBR.00064-21,Large Clostridial Toxins: Mechanisms and Roles in Disease,Virology
1491,http://orkg.org/orkg/resource/R266216,10.1128/cmr.18.2.247-263.2005,http://dx.doi.org/10.1128/CMR.18.2.247-263.2005,Clostridium difficile Toxins: Mechanism of Action and Role in Disease,Virology
1492,http://orkg.org/orkg/resource/R266221,10.3390/land11070993,http://dx.doi.org/10.3390/land11070993,Image Classification and Land Cover Mapping Using Sentinel-2 Imagery: Optimization of SVM Parameters,Environmental Sciences
1493,http://orkg.org/orkg/resource/R266229,10.7494/geom.2021.15.1.5,http://dx.doi.org/10.7494/geom.2021.15.1.5,"An Accuracy Analysis Comparison of Supervised Classification Methods for Mapping Land Cover Using Sentinel 2 Images in the Al‑Hawizeh Marsh Area, Southern Iraq",Environmental Sciences
1494,http://orkg.org/orkg/resource/R266243,10.1016/j.toxicon.2017.11.003,http://dx.doi.org/10.1016/j.toxicon.2017.11.003,"Clostridium difficile and Clostridium sordellii toxins, proinflammatory versus anti-inflammatory response",Virology
1495,http://orkg.org/orkg/resource/R266261,10.1177/1040638717737125,http://dx.doi.org/10.1177/1040638717737125,Infectious necrotic hepatitis caused by Clostridium novyi type B in a horse: case report and review of the literature,Virology
1496,http://orkg.org/orkg/resource/R266273,10.2217/fmb.13.168,http://dx.doi.org/10.2217/fmb.13.168,Towards an understanding of the role of Clostridium perfringens toxins in human and animal disease,Virology
1497,http://orkg.org/orkg/resource/R266296,10.1016/j.mib.2013.11.004,http://dx.doi.org/10.1016/j.mib.2013.11.004,Staphylococcus aureus toxins,Virology
1498,http://orkg.org/orkg/resource/R266321,10.1007/5584_2019_403,http://dx.doi.org/10.1007/5584_2019_403,Role of Major Toxin Virulence Factors in Pertussis Infection and Disease Pathogenesis,Virology
1499,http://orkg.org/orkg/resource/R266335,10.1111/j.1365-2958.2005.04893.x,http://dx.doi.org/10.1111/j.1365-2958.2005.04893.x,"AIP56, a novel plasmid-encoded virulence factor of Photobacterium damselae subsp. piscicida with apoptogenic activity against sea bass macrophages and neutrophils",Virology
1500,http://orkg.org/orkg/resource/R266384,10.1146/annurev-micro-091014-104523,http://dx.doi.org/10.1146/annurev-micro-091014-104523,Anthrax Pathogenesis,Virology
1501,http://orkg.org/orkg/resource/R266400,10.1126/science.283.5403.854,http://dx.doi.org/10.1126/science.283.5403.854,Mycolactone: A Polyketide Toxin from Mycobacterium ulcerans Required for Virulence,Virology
1502,http://orkg.org/orkg/resource/R266407,10.1007/s00424-011-0947-0,http://dx.doi.org/10.1007/s00424-011-0947-0,Rotavirus toxin NSP4 induces diarrhea by activation of TMEM16A and inhibition of Na+ absorption,Virology
1503,http://orkg.org/orkg/resource/R266414,10.2527/jas.2006-508,http://dx.doi.org/10.2527/jas.2006-508,Shiga toxin-producing Escherichia coli: An overview1,Virology
1504,http://orkg.org/orkg/resource/R267012,10.1111/j.1755-263X.2012.00259.x,https://conbio.onlinelibrary.wiley.com/doi/10.1111/j.1755-263X.2012.00259.x,Willing or unwilling to share primary biodiversity data: results and implications of an international survey,Zoology
1505,http://orkg.org/orkg/resource/R267016,10.1371/journal.pone.0129506,https://journals.plos.org/plosone/article?id=10.1371/journal.pone.0129506,Biomedical Data Sharing and Reuse: Attitudes and Practices of Clinical and Scientific Research Staff,Biomedical
1506,http://orkg.org/orkg/resource/R272009,10.1145/1719970.1720021,https://dl.acm.org/doi/abs/10.1145/1719970.1720021?casa_token=8Ia70lgZMpUAAAAA:IAuvnba-dl5B7CqGgbrqq_KkYSC3W8uFOwXvVndqIqk9UjWJoTXh0oUuG3EwkZD3qZjv6_iIEmnM4U8,Intelligent food planning: personalized recipe recommendation,Computer Engineering
1507,http://orkg.org/orkg/resource/R275003,10.3390/su142113730,http://dx.doi.org/10.3390/su142113730,A Study on the Difference of LULC Classification Results Based on Landsat 8 and Landsat 9 Data,Environmental Sciences
1508,http://orkg.org/orkg/resource/R277019,10.1080/10106049.2022.2152496,http://dx.doi.org/10.1080/10106049.2022.2152496,Comparative Evaluation of Operational Land Imager sensor on board Landsat 8 and Landsat 9 for Land use Land Cover Mapping over a Heterogeneous Landscape,Environmental Sciences
1509,http://orkg.org/orkg/resource/R277060,10.1007/s40328-022-00400-9,http://dx.doi.org/10.1007/s40328-022-00400-9,Land use/land cover classification with Landsat-8 and Landsat-9 satellite images: a comparative analysis between forest- and agriculture-dominated landscapes using different machine learning methods,Environmental Sciences
1510,http://orkg.org/orkg/resource/R277068,10.3390/rs14225734,http://dx.doi.org/10.3390/rs14225734,Above-Ground Biomass Estimation for Coniferous Forests in Northern China Using Regression Kriging and Landsat 9 Images,Environmental Sciences
1511,http://orkg.org/orkg/resource/R277084,10.3390/rs14184476,http://dx.doi.org/10.3390/rs14184476,Estimate the Earliest Phenophase for Garlic Mapping Using Time Series Landsat 8/9 Images,Environmental Sciences
1512,http://orkg.org/orkg/resource/R280000,10.1016/j.cose.2021.102532,http://dx.doi.org/10.1016/j.cose.2021.102532,Design-knowledge in learning plant dynamics for detecting process anomalies in water treatment plants,Security and Dependability
1513,http://orkg.org/orkg/resource/R280271,10.1002/chem.202100452,https://chemistry-europe.onlinelibrary.wiley.com/doi/full/10.1002/chem.202100452,"The Effect of Interlayer Anion Grafting on Water Oxidation Electrocatalysis: A Comparative Study of Ni‐ and Co‐Based Brucite‐Type Layered Hydroxides, Layered Double Hydroxides and Hydroxynitrate Salts",Inorganic Chemistry
1514,http://orkg.org/orkg/resource/R280274,10.1039/d1ma00381j,https://pubs.rsc.org/en/content/articlelanding/2021/ma/d1ma00381j,Sustainable oxygen evolution catalysis – electrochemical generation of mössbauerite via corrosion engineering of steel,Inorganic Chemistry
1515,http://orkg.org/orkg/resource/R280275,10.1039/d1ma00381j,https://pubs.rsc.org/en/content/articlelanding/2021/ma/d1ma00381j,Sustainable oxygen evolution catalysis – electrochemical generation of mössbauerite via corrosion engineering of steel,Inorganic Chemistry
1516,http://orkg.org/orkg/resource/R280280,10.1109/access.2020.2993335,http://dx.doi.org/10.1109/ACCESS.2020.2993335,Multivariate Abnormal Detection for Industrial Control Systems Using 1D CNN and GRU,Security and Dependability
1517,http://orkg.org/orkg/resource/R280537,10.5114/biolsport.2021.101605,http://dx.doi.org/10.5114/biolsport.2021.101605,Globally altered sleep patterns and physical activity levels by confinement in 5056 individuals: ECLB COVID-19 international online survey,"Public Health, Health Services Research, Social Medicine"
1518,http://orkg.org/orkg/resource/R280553,10.1016/j.compag.2017.08.021,http://dx.doi.org/10.1016/j.compag.2017.08.021,Comparison of regression methods for spatial downscaling of soil organic carbon stocks maps,Environmental Sciences
1519,http://orkg.org/orkg/resource/R280574,10.1007/s10661-016-5204-8,http://dx.doi.org/10.1007/s10661-016-5204-8,The effectiveness of digital soil mapping to predict soil properties over low-relief areas,Environmental Sciences
1520,http://orkg.org/orkg/resource/R280584,10.1016/j.geoderma.2015.07.016,http://dx.doi.org/10.1016/j.geoderma.2015.07.016,Digital mapping of soil carbon in a viticultural region of Southern Brazil,Environmental Sciences
1521,http://orkg.org/orkg/resource/R280595,10.1007/s10661-017-6197-7,http://dx.doi.org/10.1007/s10661-017-6197-7,"Digital soil mapping using remote sensing indices, terrain attributes, and vegetation features in the rangelands of northeastern Iran",Environmental Sciences
1522,http://orkg.org/orkg/resource/R280601,10.1016/j.scitotenv.2017.02.116,http://dx.doi.org/10.1016/j.scitotenv.2017.02.116,Assessing top- and subsoil organic carbon stocks of Low-Input High-Diversity systems using soil and vegetation characteristics,Environmental Sciences
1523,http://orkg.org/orkg/resource/R280610,10.1590/18069657rbcs20170413,http://dx.doi.org/10.1590/18069657rbcs20170413,Digital Soil Mapping of Soil Properties in the “Mar de Morros” Environment Using Spectral Data,Environmental Sciences
1524,http://orkg.org/orkg/resource/R280616,10.1016/j.ecolind.2017.02.010,http://dx.doi.org/10.1016/j.ecolind.2017.02.010,Assessing soil organic carbon stocks under current and potential forest cover using digital soil mapping and spatial generalisation,Environmental Sciences
1525,http://orkg.org/orkg/resource/R280623,10.1016/j.geoderma.2018.09.006,http://dx.doi.org/10.1016/j.geoderma.2018.09.006,"Digital mapping of soil properties using multiple machine learning in a semi-arid region, central Iran",Environmental Sciences
1526,http://orkg.org/orkg/resource/R280629,10.1111/ejss.12446,http://dx.doi.org/10.1111/ejss.12446,Multivariate mapping of soil with structural equation modelling: Multivariate soil mapping using SEM,Environmental Sciences
1527,http://orkg.org/orkg/resource/R280637,10.1016/j.geoderma.2017.11.006,http://dx.doi.org/10.1016/j.geoderma.2017.11.006,A systematic study on the application of scatter-corrective and spectral-derivative preprocessing for multivariate prediction of soil organic carbon by Vis-NIR spectra,Environmental Sciences
1528,http://orkg.org/orkg/resource/R280643,10.1016/j.geodrs.2020.e00260,http://dx.doi.org/10.1016/j.geodrs.2020.e00260,Spatial prediction of soil organic carbon using machine learning techniques in western Iran,Environmental Sciences
1529,http://orkg.org/orkg/resource/R280649,10.5194/soil-8-587-2022,http://dx.doi.org/10.5194/soil-8-587-2022,Spatial prediction of organic carbon in German agricultural topsoil using machine learning algorithms,Environmental Sciences
1530,http://orkg.org/orkg/resource/R280657,10.1016/j.geodrs.2015.12.002,http://dx.doi.org/10.1016/j.geodrs.2015.12.002,"Mapping soil organic carbon content over New South Wales, Australia using local regression kriging",Environmental Sciences
1531,http://orkg.org/orkg/resource/R280663,10.1186/s13021-021-00195-2,http://dx.doi.org/10.1186/s13021-021-00195-2,Multi-predictor mapping of soil organic carbon in the alpine tundra: a case study for the central Ecuadorian páramo,Environmental Sciences
1532,http://orkg.org/orkg/resource/R280670,10.1016/j.catena.2016.01.001,http://dx.doi.org/10.1016/j.catena.2016.01.001,Spatial prediction of soil surface texture in a semiarid region using random forest and multiple linear regressions,Environmental Sciences
1533,http://orkg.org/orkg/resource/R280712,10.3390/agronomy12030638,http://dx.doi.org/10.3390/agronomy12030638,Combining Variable Selection and Multiple Linear Regression for Soil Organic Matter and Total Nitrogen Estimation by DRIFT-MIR Spectroscopy,Environmental Sciences
1534,http://orkg.org/orkg/resource/R280835,10.1145/3440755,https://arxiv.org/abs/2004.13820,Evolution of Semantic Similarity—A Survey,Computer Engineering
1535,http://orkg.org/orkg/resource/R281017,10.3390/rs13214450,http://dx.doi.org/10.3390/rs13214450,Modelling of Vegetation Dynamics from Satellite Time Series to Determine Proglacial Primary Succession in the Course of Global Warming—A Case Study in the Upper Martell Valley (Eastern Italian Alps),Environmental Sciences
1536,http://orkg.org/orkg/resource/R281045,10.4491/eer.2019.255,http://dx.doi.org/10.4491/eer.2019.255,Glacier changes monitoring in Bhutan High Himalaya using remote sensing technology,Environmental Sciences
1537,http://orkg.org/orkg/resource/R281059,10.1016/j.jag.2021.102445,http://dx.doi.org/10.1016/j.jag.2021.102445,Glacier classification from Sentinel-2 imagery using spatial-spectral attention convolutional model,Environmental Sciences
1538,http://orkg.org/orkg/resource/R281078,10.1109/secpri.1989.36295,http://dx.doi.org/10.1109/SECPRI.1989.36295,The Chinese Wall security policy,Security and Dependability
1539,http://orkg.org/orkg/resource/R281082,10.1145/263552.263629,http://dx.doi.org/10.1145/263552.263629,The AVANTI project: prototyping and evaluation with a cognitive walkthrough based on the Norman's model of action,Social Psychology
1540,http://orkg.org/orkg/resource/R281087,10.1145/1280680.1280687,http://dx.doi.org/10.1145/1280680.1280687,Usability of anonymous web browsing: an examination of Tor interfaces and deployability,Security and Dependability
1541,http://orkg.org/orkg/resource/R281219,10.1145/3264888.3264896,http://dx.doi.org/10.1145/3264888.3264896,Detecting Cyber Attacks in Industrial Control Systems Using Convolutional Neural Networks,Security and Dependability
1542,http://orkg.org/orkg/resource/R281223,10.1016/j.cose.2020.101935,http://dx.doi.org/10.1016/j.cose.2020.101935,Anomaly detection in Industrial Control Systems using Logical Analysis of Data,Security and Dependability
1543,http://orkg.org/orkg/resource/R281229,10.1016/j.rse.2020.112033,http://dx.doi.org/10.1016/j.rse.2020.112033,Automated detection of rock glaciers using deep learning and object-based image analysis,Environmental Sciences
1544,http://orkg.org/orkg/resource/R281249,10.1016/j.coldregions.2021.103421,http://dx.doi.org/10.1016/j.coldregions.2021.103421,"Integration of optical, SAR and DEM data for automated detection of debris-covered glaciers over the western Nyainqentanglha using a random forest classifier",Environmental Sciences
1545,http://orkg.org/orkg/resource/R281262,10.1016/b978-044481862-1.50096-0,http://dx.doi.org/10.1016/B978-044481862-1.50096-0,Cognitive Walkthroughs,Human Computer Interfaces
1546,http://orkg.org/orkg/resource/R281385,10.48550/arXiv.2208.12523,https://arxiv.org/abs/2208.12523,"ESC-Rules: Explainable, Semantically Constrained Rule Sets",Artificial Intelligence
1547,http://orkg.org/orkg/resource/R281397,10.48550/arXiv.2208.05358,https://arxiv.org/abs/2208.05358,"CLEVR-Math: A Dataset for Compositional Language, Visual and Mathematical Reasoning",Artificial Intelligence
1548,http://orkg.org/orkg/resource/R281403,10.48550/arXiv.2206.04724,https://arxiv.org/abs/2206.04724,Modular Design Patterns for Neural-symbolic Integration: Refinement and Combination,Artificial Intelligence
1549,http://orkg.org/orkg/resource/R281407,10.48550/arXiv.2207.14000,https://arxiv.org/abs/2207.14000,Multi-Step Deductive Reasoning Over Natural Language: An Empirical Study on Out-of-Distribution Generalisation,Artificial Intelligence
1550,http://orkg.org/orkg/resource/R282285,10.48550/arXiv.2212.07507,https://arxiv.org/abs/2212.07507,"Artificial Intelligence for Health Message Generation: Theory, Method, and an Empirical Study Using Prompt Engineering",Health Communication
1551,http://orkg.org/orkg/resource/R282296,10.3390/rs13193846,http://dx.doi.org/10.3390/rs13193846,"Monitoring of Spatiotemporal Change of Green Spaces in Relation to the Land Surface Temperature: A Case Study of Belgrade, Serbia",Environmental Sciences
1552,http://orkg.org/orkg/resource/R282413,10.1038/s41598-020-66168-6,http://dx.doi.org/10.1038/s41598-020-66168-6,"Spatial relationship between land-use/land-cover change and land surface temperature in the Dongting Lake area, China",Environmental Sciences
1553,http://orkg.org/orkg/resource/R283031,10.1016/j.ejrs.2016.11.003,http://dx.doi.org/10.1016/j.ejrs.2016.11.003,Detection of land use and land cover change and land surface temperature in English Bazar urban centre,Environmental Sciences
1554,http://orkg.org/orkg/resource/R283045,10.1080/22797254.2018.1542976,http://dx.doi.org/10.1080/22797254.2018.1542976,The influence of land-use/land-cover changes on land surface temperature: a case study of Kuala Lumpur metropolitan city,Environmental Sciences
1555,http://orkg.org/orkg/resource/R283113,10.4236/jgis.2019.111004,http://dx.doi.org/10.4236/jgis.2019.111004,"A Correlation Analysis of the Relationship between Land Use and Land Cover/Land Surface Temperature in Abuja Municipal, FCT, Nigeria",Environmental Sciences
1556,http://orkg.org/orkg/resource/R283122,10.7717/peerj.9115,http://dx.doi.org/10.7717/peerj.9115,"Assessment and simulation of land use and land cover change impacts on the land surface temperature of Chaoyang District in Beijing, China",Environmental Sciences
1557,http://orkg.org/orkg/resource/R283133,10.3390/su142214868,http://dx.doi.org/10.3390/su142214868,"Investigating the Relationship between Land Use/Land Cover Change and Land Surface Temperature Using Google Earth Engine; Case Study: Melbourne, Australia",Environmental Sciences
