,paper,doi,url,paper_title,research_field_label
2235,http://orkg.org/orkg/resource/R110406,10.1371/journal.pbio.1002299,https://storage.googleapis.com/plos-corpus-prod/10.1371/journal.pbio.1002299/1/pbio.1002299.pdf?X-Goog-Algorithm=GOOG4-RSA-SHA256&X-Goog-Credential=wombat-sa%40plos-prod.iam.gserviceaccount.com%2F20210530%2Fauto%2Fstorage%2Fgoog4_request&X-Goog-Date=20210530T231706Z&X-Goog-Expires=86400&X-Goog-SignedHeaders=host&X-Goog-Signature=1d057007134ba885ae92472f5f1326814eacdb4a368f43a226455fcb8704d898db2b7e8e49f24e900741e0abe2771b97adb61a16802ea8ea8237e86424d61a8e18e6d6b75ea6191de48badbbfaf123103e85a4f327aa42a6ea0cca8390884f4b40dad970e4e505b1d5b5f2bc5176666ed68f7aef608914d89bdc67b37a4f6822dcc787060ae8690ec75b643b6d157be2360a1f90d5c2cb40b7b686629ea74efc9abec13275a6555fe486780651bbe43b58f871eba023380268ce1dae6a7bb3902faa5770055b649e2e633c192fb0bfe10ba77f04495c7c9142965e74e2f30a551b1582068a0ab99c1fe78c735201adbe48ee14a58f17b495d72e85a59a91cc4f,Quantifying the Determinants of Evolutionary Dynamics Leading to Drug Resistance,Bacteriology
2236,http://orkg.org/orkg/resource/R110410,10.1007/978-3-319-45447-4_17,https://link.springer.com/chapter/10.1007%2F978-3-319-45447-4_17,Belt Losses Evaluation for a Push-Belt CVT,Tribology
2237,http://orkg.org/orkg/resource/R110414,10.1098/rspb.2017.2687,https://royalsocietypublishing.org/doi/10.1098/rspb.2017.2687,Predicting drug resistance evolution: insights from antimicrobial peptides and antibiotics,Pathogenic Microbiology
2238,http://orkg.org/orkg/resource/R110415,10.1007/978-3-319-45447-4_33,https://link.springer.com/chapter/10.1007%2F978-3-319-45447-4_33,Modeling the Energy Evaluation for an Electric Machine,Electro-Mechanical Systems
2239,http://orkg.org/orkg/resource/R110507,10.1109/BIBE.2016.59,https://ieeexplore.ieee.org/abstract/document/7789981,Improved Nephron Model for Pressure-Diuresis and Pressure-Natriuresis,Computational Biology
2240,http://orkg.org/orkg/resource/R110509,10.1152/ajprenal.00500.2013,https://pubmed.ncbi.nlm.nih.gov/24553433/,Dominant factors that govern pressure natriuresis in diuresis and antidiuresis: a mathematical model,Computational Biology
2241,http://orkg.org/orkg/resource/R110511,10.1186/1472-6793-12-6,https://pubmed.ncbi.nlm.nih.gov/22583378/,"Mechanisms of pressure-diuresis and
pressure-natriuresis in Dahl salt-resistant and
Dahl salt-sensitive rats",Computational Biology
2242,http://orkg.org/orkg/resource/R110542,10.26913/80102017.0101.0007,http://avant.edu.pl/wp-content/uploads/Szubart-Why-Foot-Tapping.pdf,Why Foot-Tapping Is Important but Not Enough? Some Methodological Problems in the Embodied Approach to Musical Meaning,Cognition and Perception
2243,http://orkg.org/orkg/resource/R110545,10.14394/filnau.2019.0014,https://www.fn.uw.edu.pl/index.php/fn/article/view/1071, Musical Representation and Philosophy of Mind,Philosophy of Mind
2244,http://orkg.org/orkg/resource/R110550,10.1177/10298649100140s104,https://journals.sagepub.com/doi/abs/10.1177/10298649100140S104,An embodied approach to music semantics,Cognition and Perception
2245,http://orkg.org/orkg/resource/R110557,10.1177/1029864909013002091,https://journals.sagepub.com/doi/10.1177/1029864909013002091,The evolutionary nature of musical meaning,Cognition and Perception
2246,http://orkg.org/orkg/resource/R110560,10.1038/nn1197,https://pubmed.ncbi.nlm.nih.gov/14983184,"Music, language and meaning: brain signatures of semantic processing",Cognition and Perception
2247,http://orkg.org/orkg/resource/R110601,10.5830/cvja-2019-019,https://journals.co.za/doi/abs/10.5830/CVJA-2019-019,Natural cocoa inhibits maternal hypercholesterolaemia-induced atherogenesis in rabbit pups,Anatomy
2248,http://orkg.org/orkg/resource/R110605,10.1001/jamacardio.2018.3546,https://jamanetwork.com/journals/jamacardiology/article-abstract/2711640,Epigenetic Hallmarks of Fetal Early Atherosclerotic Lesions in Humans,Anatomy
2249,http://orkg.org/orkg/resource/R110608,10.1016/j.jnutbio.2020.108575,https://www.sciencedirect.com/science/article/pii/S0955286320306070,Maternal hypercholesterolemia exacerbates atherosclerosis lesions in female offspring through potentiating macrophage polarization toward an inflammatory M1 phenotype,Anatomy
2250,http://orkg.org/orkg/resource/R110614,10.1177/1708538113492516,https://journals.sagepub.com/doi/abs/10.1177/1708538113492516,Hypercholesterolemia in pregnant mice increases the susceptibility to atherosclerosis in adult life,Anatomy
2251,http://orkg.org/orkg/resource/R110617,10.1155/2014/280497,https://www.hindawi.com/journals/bmri/2014/280497/,Early Onset Intrauterine Growth Restriction in a Mouse Model of Gestational Hypercholesterolemia and Atherosclerosis,Anatomy
2252,http://orkg.org/orkg/resource/R110659,10.1002/net.21817,https://onlinelibrary.wiley.com/doi/full/10.1002/net.21817,Faster computation of successive bounds on the group betweenness centrality,Theory/Algorithms
2253,http://orkg.org/orkg/resource/R110665,10.1128/aac.02434-15,https://www.ncbi.nlm.nih.gov/pmc/articles/PMC4775937/pdf/zac1717.pdf,Combination Effects of Antimicrobial Peptides,Pathogenic Microbiology
2254,http://orkg.org/orkg/resource/R110680,10.1016/j.socnet.2009.02.003,https://www.sciencedirect.com/science/article/pii/S0378873309000045,Group betweenness and co-betweenness: Inter-related notions of coalition centrality,Theory/Algorithms
2255,http://orkg.org/orkg/resource/R110694,10.1103/physreve.76.056709,https://journals.aps.org/pre/abstract/10.1103/PhysRevE.76.056709,Fast algorithm for successive computation of group betweenness centrality,Theory/Algorithms
2256,http://orkg.org/orkg/resource/R110701,10.1016/j.socnet.2007.11.001,https://www.sciencedirect.com/science/article/pii/S0378873307000731,On variants of shortest-path betweenness centrality and their generic computation,Theory/Algorithms
2257,http://orkg.org/orkg/resource/R110723,10.1016/j.wen.2020.05.004,https://www.sciencedirect.com/science/article/pii/S2588912520300254,"The water-energy-food nexus: A holistic approach for resource security in Iran, Iraq, and Turkey",Civil and Environmental Engineering
2258,http://orkg.org/orkg/resource/R110739,10.1002/ajmg.a.62229,https://onlinelibrary.wiley.com/doi/abs/10.1002/ajmg.a.62229,"Evaluation of sleep‐disordered breathing and its relationship with respiratory parameters in children with mucopolysaccharidosis Type
            IVA
            and
            VI",Genetics
2259,http://orkg.org/orkg/resource/R110813,10.7150/ntno.51955,https://www.ntno.org/v05p0113.htm,Resveratrol loaded polymeric micelles for theranostic targeting of breast cancer cells,Medicinal Chemistry and Pharmaceutics
2260,http://orkg.org/orkg/resource/R110819,10.1002/ajmg.a.33902,https://onlinelibrary.wiley.com/doi/full/10.1002/ajmg.a.33902,Sleep abnormalities in untreated patients with mucopolysaccharidosis type VI,Genetics
2261,http://orkg.org/orkg/resource/R110833,10.1002/ppul.21309,https://pubmed.ncbi.nlm.nih.gov/20717914/,Polysomnographic characteristics in patients with mucopolysaccharidoses,Genetics
2262,http://orkg.org/orkg/resource/R110858,10.1016/j.poly.2017.06.047,https://www.sciencedirect.com/science/article/abs/pii/S0277538717304655,"Multinuclear rare-earth metal complexes supported by chalcogen-based 1,2,3-triazole",Inorganic Chemistry
2263,http://orkg.org/orkg/resource/R110866,10.1007/s11325-014-0944-6,https://pubmed.ncbi.nlm.nih.gov/24705807/,"Prevalence of obstructive sleep apnea in patients with mucopolysaccharidosis types I, II, and VI in a reference center",Genetics
2264,http://orkg.org/orkg/resource/R110879,10.1007/s10545-009-1170-4,https://link.springer.com/article/10.1007/s10545-009-1170-4,Sleep-related breathing in children with mucopolysaccharidosis,Genetics
2265,http://orkg.org/orkg/resource/R110896, http://dx.doi.org/10.1007/BF02886190.,https://link.springer.com/article/10.1007%2FBF02886190 ,Value of ecosystem services in China,Forest Management
2266,http://orkg.org/orkg/resource/R110899,10.1007/s10545-007-0555-5,https://link.springer.com/article/10.1007/s10545-007-0555-5,"Upper airway obstructive disease in mucopolysaccharidoses: Polysomnography, computed tomography and nasal endoscopy findings",Genetics
2267,http://orkg.org/orkg/resource/R110913,10.1021/acs.inorgchem.1c00798,https://pubs.acs.org/doi/abs/10.1021/acs.inorgchem.1c00798,Multinuclear Lanthanide-Implanted Tetrameric Dawson-Type Phosphotungstates with Switchable Luminescence Behaviors Induced by Fast Photochromism,Inorganic Chemistry
2268,http://orkg.org/orkg/resource/R110929,10.1016/j.ccr.2016.01.009,https://www.sciencedirect.com/science/article/abs/pii/S001085451530059X,Synthesis of heterometallic chalcogenides containing lanthanide and group 13–15 metal elements,Inorganic Chemistry
2269,http://orkg.org/orkg/resource/R110935,10.1016/j.ecocom.2012.01.001,https://www.sciencedirect.com/science/article/abs/pii/S1476945X12000025?via%3Dihub ,Economical assessment of forest ecosystem services in China: Characteristics and implications,Forest Management
2270,http://orkg.org/orkg/resource/R110941,10.1021/jo501364b,https://pubs.acs.org/doi/10.1021/jo501364b,Microwave-Assisted Cobinamide Synthesis,Organic Chemistry
2271,http://orkg.org/orkg/resource/R110951,10.1002/ejic.202000148,https://chemistry-europe.onlinelibrary.wiley.com/doi/abs/10.1002/ejic.202000148,"Synthesis, Structure, and Reactivity of Monoguanidinate Rare-Earth Metal Aminobenzyl Enolate Complexes: Synthesis, Structure, and Reactivity of Monoguanidinate Rare-Earth Metal Aminobenzyl Enolate Complexes",Inorganic Chemistry
2272,http://orkg.org/orkg/resource/R110964,10.1016/j.ccr.2016.12.007,https://www.sciencedirect.com/science/article/abs/pii/S0010854516304520,Rare-earth metal complexes of β-diketiminato ligands bearing pendant nitrogen or oxygen donors,Inorganic Chemistry
2273,http://orkg.org/orkg/resource/R110972,10.1021/acs.organomet.9b00631,https://pubs.acs.org/doi/abs/10.1021/acs.organomet.9b00631,Mixed Methyl Aryloxy Rare-Earth-Metal Complexes Stabilized by a Superbulky Tris(pyrazolyl)borato Ligand,Inorganic Chemistry
2274,http://orkg.org/orkg/resource/R110988,10.1016/j.landurbplan.2004.08.008,https://www.sciencedirect.com/science/article/abs/pii/S0169204605000071,"Recreation–amenity use and contingent valuation of urban greenspaces in Guangzhou, China",Forest Management
2275,http://orkg.org/orkg/resource/R110993,10.1039/c8dt04647f,https://pubs.rsc.org/en/content/articlelanding/2019/dt/c8dt04647f#!divAbstract,"Anilido-oxazoline-ligated rare-earth metal complexes: synthesis, characterization and highly cis-1,4-selective polymerization of isoprene",Inorganic Chemistry
2276,http://orkg.org/orkg/resource/R111005,10.1039/c7sc00739f,https://pubs.rsc.org/en/content/articlelanding/2017/sc/c7sc00739f#!divAbstract,White-light emission from discrete heterometallic lanthanide-directed self-assembled complexes in solution,Inorganic Chemistry
2277,http://orkg.org/orkg/resource/R111011,10.1016/j.ccr.2019.213098,https://www.sciencedirect.com/science/article/abs/pii/S0010854519303856,A structural and spectroscopic overview of molecular lanthanide complexes with fluorinated O-donor ligands,Inorganic Chemistry
2278,http://orkg.org/orkg/resource/R111016,10.1007/s11769-010-0051-y,https://link.springer.com/article/10.1007%2Fs11769-010-0051-y,Forest ecosystem services and their values in Beijing,Forest Management
2279,http://orkg.org/orkg/resource/R111023,10.1039/c8cc08120d,https://pubs.rsc.org/en/content/articlelanding/2019/cc/c8cc08120d#!divAbstract,Access to divalent lanthanide NHC complexes by redox-transmetallation from silver and CO2 insertion reactions,Inorganic Chemistry
2280,http://orkg.org/orkg/resource/R111030,10.1016/j.compenvurbsys.2016.08.007,https://doi.org/10.1016/j.compenvurbsys.2016.08.007,"Land Use detection with cell phone data using topic models: Case Santiago, Chile",Geographic Information Sciences
2281,http://orkg.org/orkg/resource/R111040,10.1021/ic00111a003,https://pubs.acs.org/doi/10.1021/ic00111a003,Efficient and Convenient Method for Axial Nucleotide Removal from Vitamin B12 and Its Derivatives,Inorganic Chemistry
2282,http://orkg.org/orkg/resource/R111056,10.1007/s13164-020-00504-7,https://link.springer.com/article/10.1007%2Fs13164-020-00504-7,Do Political Attitudes Matter for Epistemic Decisions of Scientists?,Philosophy of Science
2283,http://orkg.org/orkg/resource/R111061,10.1177/2399808319840668,https://dam-prod.media.mit.edu/x/2019/11/17/2399808319840668.pdf,Reversed urbanism: Inferring urban performance through behavioral patterns in temporal telecom data,Geographic Information Sciences
2284,http://orkg.org/orkg/resource/R111072,10.1142/s1088424611003446,https://www.worldscientific.com/doi/10.1142/S1088424611003446,One-step synthesis of α/β cyano-aqua cobinamides from vitamin B12 with Zn(II) or Cu(II) salts in methanol,Organic Chemistry
2285,http://orkg.org/orkg/resource/R111094,10.1016/j.lwt.2014.11.029,https://www.sciencedirect.com/science/article/abs/pii/S0023643814007324,Optimization of formulation and process of Australian sweet lupin (ASL)-wheat bread,Food Processing
2286,http://orkg.org/orkg/resource/R111098,https://dx.doi.org/10.3352%2Fjeehp.2006.3.3,https://www.ncbi.nlm.nih.gov/pmc/articles/PMC2631188/,The Future of e-Learning in Medical Education: Current Trend and Future Opportunity,Medicine and Health
2287,http://orkg.org/orkg/resource/R111101,10.1055/s-0028-1083187,https://www.thieme-connect.com/products/ejournals/abstract/10.1055/s-0028-1083187,"Preparation of Dicyano- and
Methylcobinamide from Vitamin B12a",Organic Chemistry
2288,http://orkg.org/orkg/resource/R111105,10.4103/2249-4863.94441,https://www.ncbi.nlm.nih.gov/pmc/articles/PMC3893955/,The Rise of E-learning and Opportunities for Indian Family Physicians,Medicine and Health
2289,http://orkg.org/orkg/resource/R111111,10.1002/cber.19560891104,https://chemistry-europe.onlinelibrary.wiley.com/doi/abs/10.1002/cber.19560891104,"Beiträge zur Chemie und Biochemie der „Cobalamine”, II. Mitteil.: Über den Abbau der „Cobalamine” mit Cer (III)-hydroxyd. 7-[D-Ribofuranosido]-adenin, ein Abbauprodukt des Pseudovitamins B12",Organic Chemistry
2290,http://orkg.org/orkg/resource/R111114,10.4314/njt.v39i4.33,http://nijotech.com/index.php/nijotech/article/view/2469,Development of optimized substitution ratio for wheatcassava-african yam bean flour composite for Nigerian bread industries,Food Processing
2291,http://orkg.org/orkg/resource/R111126,10.5901/mjss.2015.v6n6s1p341,https://www.richtmann.org/journal/index.php/mjss/article/view/8027,Trends of Democratization of the Macedonian Parliamentary Elite in Seven Mandates,Comparative Politics
2292,http://orkg.org/orkg/resource/R111135,10.1080/15298868.2020.1714711,https://www.tandfonline.com/doi/full/10.1080/15298868.2020.1714711,Intellectual humility in the sociopolitical domain,Personality and Social Contexts
2293,http://orkg.org/orkg/resource/R111213,10.1145/1559845.1559911,https://dl.acm.org/doi/10.1145/1559845.1559911,Scalable join processing on very large RDF graphs,Databases/Information Systems
2294,http://orkg.org/orkg/resource/R111417,10.1016/j.cag.2005.08.023,https://www.sciencedirect.com/science/article/pii/S0097849305001330,Enhancing collaboration in virtual reality applications,Graphics
2295,http://orkg.org/orkg/resource/R111420,10.19153/cleiej.13.1.6,http://www.clei.org/cleiej/index.php/cleiej/article/view/184,Empirical Validation of Component-based Software Systems Generation and Evaluation Approaches,Graphics
2296,http://orkg.org/orkg/resource/R111689,10.18653/v1/s19-2149,https://www.aclweb.org/anthology/S19-2149.pdf,SemEval-2019 Task 8: Fact Checking in Community Question Answering Forums,Artificial Intelligence
2297,http://orkg.org/orkg/resource/R111779,10.18653/v1/s19-2203,https://www.aclweb.org/anthology/S19-2203.pdf,Fermi at SemEval-2019 Task 8: An elementary but effective approach to Question Discernment in Community QA Forums,Artificial Intelligence
2298,http://orkg.org/orkg/resource/R111782,10.18653/v1/s19-2150,https://www.aclweb.org/anthology/S19-2150.pdf,AUTOHOME-ORCA at SemEval-2019 Task 8: Application of BERT for Fact-Checking in Community Forums,Artificial Intelligence
2299,http://orkg.org/orkg/resource/R111806,10.1007/978-3-642-25073-6_38,https://link.springer.com/chapter/10.1007%2F978-3-642-25073-6_38#aboutcontent,FedX: Optimization Techniques for Federated Query Processing on Linked Data,Databases/Information Systems
2300,http://orkg.org/orkg/resource/R135602,10.3233/SHTI190279,https://www.degruyter.com/document/doi/10.1515/comp-2019-0013/html,Model-Driven Architecture Based Software Development for Epidemiological Surveillance Systems,Software Engineering
2301,http://orkg.org/orkg/resource/R135704,10.1021/jacs.9b10686,https://pubs.acs.org/doi/abs/10.1021/jacs.9b10686,Counterion-Mediated Crossing of the Cyanine Limit in Crystals and Fluid Solution: Bond Length Alternation and Spectral Broadening Unveiled by Quantum Chemistry,Physical Chemistry
2302,http://orkg.org/orkg/resource/R135710,10.1021/ja9100886,https://pubs.acs.org/doi/10.1021/ja9100886,Continuous Symmetry Breaking Induced by Ion Pairing Effect in Heptamethine Cyanine Dyes: Beyond the Cyanine Limit,Physical Chemistry
2303,http://orkg.org/orkg/resource/R135750,10.1139/gen-2018-0063,http://www.nrcresearchpress.com/doi/10.1139/gen-2018-0063,Characterization and comparison of poorly known moth communities through DNA barcoding in two Afrotropical environments in Gabon,"Ecology and Biodiversity of Animals and Ecosystems, Organismic Interactions"
2304,http://orkg.org/orkg/resource/R135836,https://doi.org/10.1162/dint_a_00031,https://direct.mit.edu/dint/article-pdf/2/1-2/87/1893343/dint_a_00031.pdf,Making FAIR Easy with FAIR Tools: From Creolization to Convergence,Information Science
2305,http://orkg.org/orkg/resource/R135842,10.1162/dint_a_00051,https://direct.mit.edu/dint/article-pdf/2/1-2/285/1893427/dint_a_00051.pdf,Considerations for the Conduction and Interpretation of FAIRness Evaluations,Information Science
2306,http://orkg.org/orkg/resource/R135844,10.15497/rda00035,https://zenodo.org/record/3629618/files/FAIR_Data_Maturity_Model.pdf,Results of an Analysis of Existing FAIR Assessment Tools,Information Science
2307,http://orkg.org/orkg/resource/R135860,10.1038/sdata.2018.118,https://www.nature.com/articles/sdata2018118.pdf,A design framework and exemplar metrics for FAIRness,Information Science
2308,http://orkg.org/orkg/resource/R135869,10.1101/418376,https://www.biorxiv.org/content/10.1101/418376v2.full.pdf,"Evaluating FAIR-Compliance Through an Objective, Automated, Community-Governed Framework",Information Science
2309,http://orkg.org/orkg/resource/R135878,10.1109/escience.2018.00027,https://ieeexplore.ieee.org/stamp/stamp.jsp?tp=&arnumber=8588646,How FAIR Can you Get? Image Retrieval as a Use Case to Calculate FAIR Metrics,Computer Sciences
2310,http://orkg.org/orkg/resource/R135882,10.5281/ZENODO.3251593,https://zenodo.org/record/3251593/files/FAIR%20DATA%20DRAFT%20-%20FINAL.pdf,FAIRness of Repositories & Their Data: A Report from LIBER's Research Data Management Working Group,Arts and Humanities
2311,http://orkg.org/orkg/resource/R135895,10.3390/nano10102068,https://www.mdpi.com/2079-4991/10/10/2068/pdf,A Semi-Automated Workflow for FAIR Maturity Indicators in the Life Sciences,Life Sciences
2312,http://orkg.org/orkg/resource/R135951,10.14569/IJACSA.2011.020218,http://dx.doi.org/10.14569/IJACSA.2011.020218,To Generate the Ontology from Java Source Code,Artificial Intelligence
2313,http://orkg.org/orkg/resource/R135960,10.1109/IRI.2008.4583022,https://doi.org/10.1109/IRI.2008.4583022,Knowledge extraction from web-based application source code: An approach to database reverse engineering for ontology development,Artificial Intelligence
2314,http://orkg.org/orkg/resource/R136193,10.1098/rspb.2010.1089,https://royalsocietypublishing.org/doi/10.1098/rspb.2010.1089,Complete DNA barcode reference library for a country's butterfly fauna reveals high performance for temperate Europe,"Ecology and Biodiversity of Animals and Ecosystems, Organismic Interactions"
2315,http://orkg.org/orkg/resource/R136509,10.1109/WI.2005.78,https://doi.org/10.1109/WI.2005.78,Information Extraction from HTML Product Catalogues: From Source Code and Images to RDF,Artificial Intelligence
2316,http://orkg.org/orkg/resource/R136518,10.1007/978-3-319-68204-4_2,https://doi.org/10.1007/978-3-319-68204-4_2,CodeOntology: RDF-ization of Source Code,Artificial Intelligence
2317,http://orkg.org/orkg/resource/R137045,10.1117/1.jrs.15.036502,https://doi.org/10.1117/1.JRS.15.036502,"Integration of Raman, emission, and reflectance spectroscopy for earth and lunar mineralogy",Geology
2318,http://orkg.org/orkg/resource/R137053,10.1002/anie.200453765,https://onlinelibrary.wiley.com/doi/abs/10.1002/anie.200453765,Nickel-Catalyzed Cross-Coupling of Aryl Grignard Reagents with Aromatic Alkyl Ethers: An Efficient Synthesis of Unsymmetrical Biaryls,Organic Chemistry
2319,http://orkg.org/orkg/resource/R137059,10.1002/anie.200801447,https://onlinelibrary.wiley.com/doi/abs/10.1002/anie.200801447,Nickel-Catalyzed Cross-Coupling of Aryl Methyl Ethers with Aryl Boronic Esters,Organic Chemistry
2320,http://orkg.org/orkg/resource/R137062,10.1021/ja806244b,https://pubs.acs.org/doi/10.1021/ja806244b,Cross-Coupling Reactions of Aryl Pivalates with Boronic Acids,Organic Chemistry
2321,http://orkg.org/orkg/resource/R137065,10.1021/ja8056503,https://pubs.acs.org/doi/10.1021/ja8056503,Biaryl Construction via Ni-Catalyzed C−O Activation of Phenolic Carboxylates,Organic Chemistry
2322,http://orkg.org/orkg/resource/R137068,10.1038/s41467-020-19944-x,https://www.nature.com/articles/s41467-020-19944-x#Ack1,Visible-light photoredox-catalyzed C–O bond cleavage of diaryl ethers by acridinium photocatalysts at room temperature,Organic Chemistry
2323,http://orkg.org/orkg/resource/R137073,10.1126/science.1200437,https://science.sciencemag.org/content/332/6028/439,"Selective, Nickel-Catalyzed Hydrogenolysis of Aryl Ethers",Organic Chemistry
2324,http://orkg.org/orkg/resource/R137076,10.1021/acscatal.8b04172,https://pubs.acs.org/doi/10.1021/acscatal.8b04172,Selective C–O Bond Cleavage of Lignin Systems and Polymers Enabled by Sequential Palladium-Catalyzed Aerobic Oxidation and Visible-Light Photoredox Catalysis,Organic Chemistry
2325,http://orkg.org/orkg/resource/R137115,10.3390/rs9101006,https://www.mdpi.com/2072-4292/9/10/1006,Integration of Absorption Feature Information from Visible to Longwave Infrared Spectral Ranges for Mineral Mapping,Geology
2326,http://orkg.org/orkg/resource/R137118,10.1111/j.1945-5100.2005.tb00149.x,https://onlinelibrary.wiley.com/doi/abs/10.1111/j.1945-5100.2005.tb00149.x,"Spaceborne visible and thermal infrared lithologic mapping of impact-exposed subsurface lithologies at the Haughton impact structure, Devon Island, Canadian High Arctic: Applications to Mars",Geology
2327,http://orkg.org/orkg/resource/R137121,10.1016/j.pss.2018.12.007,https://doi.org/10.1016/j.pss.2018.12.007,"Mineralogy and spectroscopy (VIS near infrared and micro-Raman) of chromite from Nidar ophiolite complex, SE Ladakh, India: Implications for future planetary exploration",Geology
2328,http://orkg.org/orkg/resource/R137124,10.1016/j.chemer.2020.125729,https://doi.org/10.1016/j.chemer.2020.125729,Mineralogy and spectroscopy (visible near infrared and Fourier Transform Infrared) of Mukundpura CM2: Implications for asteroidal aqueous alteration,Geology
2329,http://orkg.org/orkg/resource/R137127,10.1016/j.chemgeo.2020.120043,https://doi.org/10.1016/j.chemgeo.2020.120043,"Spectral and Chemical Characterization of Copiapite and Rozenite from Padinjarathara in Wayanad, Southern India: Implications for Mars Exploration",Geology
2330,http://orkg.org/orkg/resource/R137130,10.1002/gj.2990,https://doi.org/10.1002/gj.2990,"Spectral and chemical characterization of gypsum-phyllosilicate association in Tiruchirapalli, South India, and its implications",Geology
2331,http://orkg.org/orkg/resource/R137133,10.1016/j.saa.2021.119677,https://doi.org/10.1016/j.saa.2021.119677,"Compositional and spectrochemical analyses of Cr-spinels in the Sittampundi Anorthosite Complex, Southern India: Implications for remote observation of spinels on the Moon",Geology
2332,http://orkg.org/orkg/resource/R137698,10.1152/ajpendo.00134.2021,https://journals.physiology.org/doi/abs/10.1152/ajpendo.00134.2021,Low dietary fiber promotes enteric expansion of a Crohn's disease-associated pathobiont independent of obesity.,Food Microbiology
2333,http://orkg.org/orkg/resource/R138006,10.1016/s0168-3659(02)00320-6,https://www.sciencedirect.com/science/article/pii/S0168365902003206?via%3Dihub,A novel controlled release formulation for the anticancer drug paclitaxel (Taxol®): PLGA nanoparticles containing vitamin E TPGS,Medicinal Chemistry and Pharmaceutics
2334,http://orkg.org/orkg/resource/R138014,10.1016/j.ijpharm.2010.05.008,https://www.sciencedirect.com/science/article/pii/S0378517310003510?via%3Dihub,"Nanoparticles of lipid monolayer shell and biodegradable polymer core for controlled release of paclitaxel: Effects of surfactants on particles size, characteristics and in vitro performance",Medicinal Chemistry and Pharmaceutics
2335,http://orkg.org/orkg/resource/R138024,10.1016/s0168-3659(00)00364-3,https://www.sciencedirect.com/science/article/pii/S0168365900003643?via%3Dihub,Effects of emulsifiers on the controlled release of paclitaxel (Taxol®) from nanospheres of biodegradable polymers,Medicinal Chemistry and Pharmaceutics
2336,http://orkg.org/orkg/resource/R138032,10.1007/s12272-001-1267-5,https://link.springer.com/article/10.1007%2Fs12272-001-1267-5,"The intracellular uptake ability of chitosan-coated Poly (D,L-lactideco-glycolide) nanoparticles",Medicinal Chemistry and Pharmaceutics
